,username,location,created,followers,timesRetweeted,text,hashtags
0,servingupshade,,2021-04-29 23:11:28,2210,0,@joesox04 He is a trooper. I wish him great success in his baseball career,[]
1,Coach_Fontaine,Rhode Island,2021-04-29 23:11:26,243,0,@PilgrimMilitia @PilgrimMilitia he keeps ducking me with our baseball challenge. Might need you to help me set it up!,[]
2,bushboysmom,,2021-04-29 23:11:24,211,4,Baseball: #11 Rowan 8 - Stockton 6,[]
3,FOnions2,,2021-04-29 23:11:23,69,0,@espn @SportsCenter You showed GOLF over baseball??,[]
4,PDSHead,"Charlotte, NC",2021-04-29 23:11:22,1790,1,"Var baseball beats Cannon, 7-5. Adam Dunaief with 2 2b and 3 rbi. Greyson Tappy gets the win with 3 shutout innings in relief. PDS ends season 11-8, 7-3 solo 2nd place in conference #pdschargers",[]
5,TheDaveShow,"Las Vegas, NV",2021-04-29 23:11:20,338,0,14-Inning Thriller! Super Mega Baseball 3 Franchise (S1G67-69) https://t.co/22x6cUcC1W via @YouTube,[]
6,Sportsandcard,,2021-04-29 23:11:19,1691,2,"2021 Topps X Derek Jeter ""Captain's Crew"" is available now. View the set details and images: https://t.co/UIFfmOTXyJ #collect #thehobby #derekjeter https://t.co/RIkQPXSOuC",[]
7,BWagner_CapGaz,,2021-04-29 23:11:18,3480,4,".@ASCavsBaseball had beaten 10-straight teams already and battled a tough St. John’s team to a tie into the night less than 24 hours earlier.

They’d show their rival @StMarysSaints exactly why.

Read how Spalding beat St. Mary's 12-1: https://t.co/G6O8kyzpKz

Photo: @pwgphoto https://t.co/UpCVilBGT3",[]
8,PHoeyOfficial,New Jersey,2021-04-29 23:11:17,1905,2713,"RT this for a chance to win a @dylanobrien signed baseball! ⚾️✍️ 

#dylanobrien 🔸 #LoveAndMonsters 🔹 #LGM https://t.co/FtHc3Da9Ji","[{'text': 'dylanobrien', 'indices': [77, 89]}, {'text': 'LoveAndMonsters', 'indices': [92, 108]}, {'text': 'LGM', 'indices': [111, 115]}]"
9,RosyC6cards,,2021-04-29 23:11:17,63,2,"The Bruins are back at Jackie Robinson Stadium this weekend to host Oregon State in series televised by the @Pac12Network. 

NOTES | https://t.co/eJ3dwoTa2T

#GoBruins https://t.co/Ug1MgqMXNs",[]
10,KimberlyKorf,,2021-04-29 23:11:15,144,1,"Varsity baseball defeated Lakin 12-2 in game one.

Korf pitched 6 innings &amp; picked up the win. Striking out 12 &amp; walking 1.

RBI: Mendoza 3 (HR), Harper (2), Salinas (1), Roa (1), Burnett (1), Littell (1), Jackson (1).

Bachman allowed 4 runs, walked 3 &amp; struck out 14 for Lakin.",[]
11,HFHS_BASEBALL,"Flossmoor, IL",2021-04-29 23:11:14,941,0,"Stagg grounds out to end the inning. McAlister will lead off in the 4th!
#compete
Vikings-9
Chargers-5","[{'text': 'compete', 'indices': [73, 81]}]"
12,utracefan72,,2021-04-29 23:11:14,1139,0,@fischer_kelli @magnumCJ FYI the @Vol_Baseball game is on ESPNU tonight 😃,[]
13,TheReal_KDubb,"LA,Houston, NYC, ATL,Tampa",2021-04-29 23:11:13,13970,0,MLB DraftKings Picks Daily Fantasy Baseball Main Slate Cheat Sheet &amp; Projections | Trevor Bauer https://t.co/9pb8VQn6ii,[]
14,stormchaserchi1,,2021-04-29 23:11:12,654,1,"@EMoriartyWX I’m glad I’m not the only one arguing the terminal velocity subject here. I’ve had 2” hail hit me, completely without wind, just dropping straight down on me and sounded like someone was hitting my car with a baseball bat on each hit. I have a bruise on my shoulder in an old pic",[]
15,MikeCole24,,2021-04-29 23:11:11,597,302,"It’s #NFLDraft Day, so you know we had to post about Prime Time. In his return to baseball in ‘01, he had an electric day at the plate. https://t.co/KquGG5lXer","[{'text': 'NFLDraft', 'indices': [19, 28]}]"
16,JulianSpillane,"Corktown, Toronto",2021-04-29 23:11:10,2905,2,"Here's a quick look at Kunio and Riki's unique mechanic: Weapon Pickups! The River City Ransom characters have access to a handful of randomly spawning items including dodgeballs, baseball bats and pipes!

Coming Soon to Mighty Fight Federation! https://t.co/HnnnTjZNqM",[]
17,DreamLanny,"Gulf Shores, AL",2021-04-29 23:11:09,2158,0,"@BalogTrinity The Dream All-American Series (DAAS) is looking to find the best 2022-2025 Baseball, Basketball, Soccer, &amp; Softball players to compete and gain recruiting exposure. If interested, please go to the website to get info and to be nominated.  https://t.co/IPdiX5dIrx https://t.co/7ik2Ef0ZKT",[]
18,BKHS_Baseball,,2021-04-29 23:11:09,213,0,Top of the second - District 3-4A - BK 0 West Nassau 0. John Costa on the bump for the Crusaders.,[]
19,seandougfan,Boston,2021-04-29 23:11:05,1150,0,"If you're surprised about baseball still being a thing, look no further than the powers at be literally prioritizing Spring baseball on main NE sports channel over the Bruins in the middle of the playoff push. Money talks.",[]
20,piggy4280,,2021-04-29 23:11:04,2502,0,PREMIUM BASEBALL PLAY COMING OUT AT https://t.co/279S48NOGs,[]
21,nikkibaseball,Arvada,2021-04-29 23:11:03,48,2,Just six games remain in the regular season for @FHSUbaseball! The Tigers are off to Emporia for their final road trip of the season this weekend. #DefendTheFort x #MIAAbb https://t.co/8uvbkNzjll,[]
22,TheReal_KDubb,"LA,Houston, NYC, ATL,Tampa",2021-04-29 23:11:03,13970,0,"Best MLB team stacks for DFS on Thursday, April 29th https://t.co/LNRYwHBqRo",[]
23,PillingOUT,United States,2021-04-29 23:11:03,35,0,Overuse is Contributing to High Rate of Arm Injuries in Youth Baseball Pitchers https://t.co/axflEkUZqE https://t.co/3PyXAEQikL,[]
24,sfroms,United States,2021-04-29 23:11:03,907,469,"President Biden spread fake news about Georgia’s voting laws. 

The uproar led Major League Baseball to move its All-Star game from Atlanta. 

The state lost 100 million in economic activity as a result. 

Will he and Stacey Abrams apologize? https://t.co/2mZObEelUv",[]
25,Theresasundstr2,"Washington, USA",2021-04-29 23:11:02,80,28,I demanded answers today from the FBI as to why the Congressional baseball practice shooting that injured several people including a Capitol Police officer and my friend ⁦@SteveScalise⁩ was classified as suicide by cop instead of domestic terrorism.  https://t.co/lmdUB6B8Uu,[]
26,truedevros,,2021-04-29 23:11:01,31,0,"@WhippyNotPoopy @billmaher Damn, it’s almost like America’s “past time” is watching people play baseball, football, basketball. Everyone watching worldwide sports, poker or even the olympics. It’s a way to just sit somewhere, relax and connect.",[]
27,DanVoiceMan91,"Kennesaw, Georgia",2021-04-29 23:10:58,645,5,"Big @SunBelt series this weekend as your Panthers host @CoastalBaseball at the GSU Baseball Complex!

Preview ➡️ https://t.co/cOmXFsVcng 

#GSUnited | #LightItBlue🔷 https://t.co/IyI5d7S00K",[]
28,KLittle220,"Pensacola, FL",2021-04-29 23:10:57,83,1,"Baseball is losing a great coach and even better person. Coach Kandler impacted so many lives and genuinely cared about his players and coaches. I loved his old school no nonsense approach, and always knew NLB players would get better playing for him. 

https://t.co/Xgw4CbD1aM",[]
29,Enstell_,Poland,2021-04-29 23:10:56,42,0,"@JakeSucky Saying ""watching someone play video games is a waste of time"" has the same mentality as ""watching real sport is a waste of time"".

Just leave your house and play baseball or something 4Head",[]
30,AYardman,,2021-04-29 23:10:56,124,9,"Since everyone has done a 180 on Fields being a perfect prospect, I do want to point this out. It’s fixable, but this motion has to go. I did it, Tebow did it — it’s a baseball player thing. Windows are way too tight in the NFL to have a windup this long below the elbow. https://t.co/foVyA9neLN",[]
31,CLhita,,2021-04-29 23:10:55,1,2713,"RT this for a chance to win a @dylanobrien signed baseball! ⚾️✍️ 

#dylanobrien 🔸 #LoveAndMonsters 🔹 #LGM https://t.co/FtHc3Da9Ji","[{'text': 'dylanobrien', 'indices': [77, 89]}, {'text': 'LoveAndMonsters', 'indices': [92, 108]}, {'text': 'LGM', 'indices': [111, 115]}]"
32,TheReal_KDubb,"LA,Houston, NYC, ATL,Tampa",2021-04-29 23:10:55,13970,0,"MLB DFS Picks, Ownership, HRs &amp; Top Stacks for DraftKings &amp; FanDuel Tournaments on Thursday https://t.co/Vkk83BnFGI",[]
33,mattT0M0,"New York, USA",2021-04-29 23:10:55,294,10,I am still looking to get in contact with Black baseball players of any ethnicity/nationality in @MiLB/@MLB in order to continue my Clubhouse Conversations interview series that is featured on @uncultureblog. If anyone that sees this could help I’d really appreciate it.,[]
34,lifestooshort50,,2021-04-29 23:10:54,163,29,I demanded answers today from the FBI as to why the Congressional baseball practice shooting that injured several people including a Capitol Police officer and my friend ⁦@SteveScalise⁩ was classified as suicide by cop instead of domestic terrorism.  https://t.co/lmdUB6B8Uu,[]
35,Bear_Roach_4,Baseball field⚾️,2021-04-29 23:10:53,726,302,"It’s #NFLDraft Day, so you know we had to post about Prime Time. In his return to baseball in ‘01, he had an electric day at the plate. https://t.co/KquGG5lXer","[{'text': 'NFLDraft', 'indices': [19, 28]}]"
36,codylope,"Honolulu, HI",2021-04-29 23:10:53,43,2271,"Anthony Rizzo really struck out Freddie Freeman tonight.

Baseball is the best. https://t.co/0SdtLQz7JZ",[]
37,DreamLanny,"Gulf Shores, AL",2021-04-29 23:10:52,2158,0,"@gracie__gregg The Dream All-American Series (DAAS) is looking to find the best 2022-2025 Baseball, Basketball, Soccer, &amp; Softball players to compete and gain recruiting exposure. If interested, please go to the website to get info and to be nominated.  https://t.co/IPdiX5dIrx https://t.co/3VRelBur0b",[]
38,WhiteSoxGolfer,,2021-04-29 23:10:50,238,0,Here come all the TLR stans acting like this team is winning because of and not in spite of him. He managed another stupid baseball game with a stupid lineup. If it wasnt for a Miggy bobble its entirely possible they lose today because of Hamilton's awful AB in that spot.,[]
39,FZELIONS1,"St Peters, MO",2021-04-29 23:10:49,2128,0,@FZEMrsBono @FZE_Baseball @FZESoccer Could catching up with Mr Bono,[]
40,aikii_imo01,,2021-04-29 23:10:48,137,99,"Shohei Ohtani has finished 20 plate appearances with his splitter this season. The results? Hitters are 0-for-19 ... with 18 strikeouts. 

Baseball's most unhittable pitch is back. STORY ➡️ https://t.co/Re8HHNmISo https://t.co/7pDyILyGkt",[]
41,dtxgus,Somewhere,2021-04-29 23:10:46,394,3,im tryna go to a baseball game,[]
42,TheReal_KDubb,"LA,Houston, NYC, ATL,Tampa",2021-04-29 23:10:46,13970,0,"Fantasy Baseball Picks: Top DraftKings MLB DFS Targets, Values for April 29 https://t.co/owmIlqdOgy",[]
43,Hannah97048239,,2021-04-29 23:10:46,11,2713,"RT this for a chance to win a @dylanobrien signed baseball! ⚾️✍️ 

#dylanobrien 🔸 #LoveAndMonsters 🔹 #LGM https://t.co/FtHc3Da9Ji","[{'text': 'dylanobrien', 'indices': [77, 89]}, {'text': 'LoveAndMonsters', 'indices': [92, 108]}, {'text': 'LGM', 'indices': [111, 115]}]"
44,chenmarie39,"Detroit, MI",2021-04-29 23:10:43,625,29,I demanded answers today from the FBI as to why the Congressional baseball practice shooting that injured several people including a Capitol Police officer and my friend ⁦@SteveScalise⁩ was classified as suicide by cop instead of domestic terrorism.  https://t.co/lmdUB6B8Uu,[]
45,therealgoldster,,2021-04-29 23:10:43,16,0,@jaysonst LIttle leagueish baseball.,[]
46,TheBigGuy110,,2021-04-29 23:10:42,304,29,"Good reminder that Joe Biden went on ESPN on opening day of the baseball season and “strongly urged” MLB to move the All Star Game, while repeating debunked lies about the state’s election law. 

They complied THAT DAY.

He and Stacey Abrams own the $100M loss. And they know it. https://t.co/fFkBX0XDTe",[]
47,allison_begley,VA,2021-04-29 23:10:40,161,2713,"RT this for a chance to win a @dylanobrien signed baseball! ⚾️✍️ 

#dylanobrien 🔸 #LoveAndMonsters 🔹 #LGM https://t.co/FtHc3Da9Ji","[{'text': 'dylanobrien', 'indices': [77, 89]}, {'text': 'LoveAndMonsters', 'indices': [92, 108]}, {'text': 'LGM', 'indices': [111, 115]}]"
48,gobigorgohome71,United States,2021-04-29 23:10:40,557,1,Freddie and Rizzo is the baseball relationship that I didn't know I needed,[]
49,FZELIONS1,"St Peters, MO",2021-04-29 23:10:40,2128,1,Family outing to watch @FZE_Baseball and @FZESoccer ! 💛🖤 https://t.co/Z43I1J0XX4,[]
50,briienodyIan,🧜🏽‍♀️ ♡ 10.31||12||2.22,2021-04-29 23:10:39,402,2713,"RT this for a chance to win a @dylanobrien signed baseball! ⚾️✍️ 

#dylanobrien 🔸 #LoveAndMonsters 🔹 #LGM https://t.co/FtHc3Da9Ji","[{'text': 'dylanobrien', 'indices': [77, 89]}, {'text': 'LoveAndMonsters', 'indices': [92, 108]}, {'text': 'LGM', 'indices': [111, 115]}]"
51,MelissaMeador14,"Amory, MS",2021-04-29 23:10:37,2159,1,"I’ve got Smithville at Hickory Flat in Game 1 of the Class 1A baseball first round playoff series. 

Bryan Clayton draws the start on the mound for the Rebels, who opt to hold ace Chris Smith for tomorrow. #djpreps",[]
52,rajai11davis,,2021-04-29 23:10:33,37988,112,"The inaugural Lou Gehrig Day will be held this year on Wed., June 2 to celebrate the HOFer who continues to inspire the movement to end ALS. We look forward to working with our Clubs and @LG4Day to continue baseball's support of the ALS community https://t.co/LGPm8mUB7Z",[]
53,happiertoday8,,2021-04-29 23:10:33,2,1,Kris Bryant. Baseball Player. @obvious_shirts https://t.co/IFYMayLt1j,[]
54,BNIAthleticDept,,2021-04-29 23:10:33,153,0,Baseball Final: Warriors 0 - Illiana Christian 13 #ForeverNoll,"[{'text': 'ForeverNoll', 'indices': [50, 62]}]"
55,zrey3258,"Mount Vernon, IL",2021-04-29 23:10:32,103,1,Baseball: Mt. Vernon 9 Cahokia 0 end 3,[]
56,DreamLanny,"Gulf Shores, AL",2021-04-29 23:10:31,2158,0,"@LindseyWisniow1 The Dream All-American Series (DAAS) is looking to find the best 2022-2025 Baseball, Basketball, Soccer, &amp; Softball players to compete and gain recruiting exposure. If interested, please go to the website to get info and to be nominated.  https://t.co/IPdiX5dIrx https://t.co/TD7WDpM19S",[]
57,HerrimanHS,"Herriman, Utah 84096",2021-04-29 23:10:31,2122,0,We would like to send our condolences to Yates and @Copperhillshigh family for their loss of Krista Yates.  Krista was an employees at CH and mother to @Hayden__Yates that plays baseball for the Grizzlies.  Mustang Nation is with you. 💕 Rest in Love Krista! https://t.co/RrjHhQvW4h,[]
58,waluigi_pic_bot,Waluigi's Tacostand,2021-04-29 23:10:30,759,0,Mario Superstar Baseball https://t.co/njR54OxII1,[]
59,Augie_Baseball,"Rock Island, Ill",2021-04-29 23:10:29,1172,0,"Augustana Vikings  12  (Pitching: #12 Jake Reusch)
North Central  5  (Batting: #7  Rios)
Bottom of 9th, 0 Out, No one on
#iscore #sportsengine","[{'text': 'iscore', 'indices': [121, 128]}, {'text': 'sportsengine', 'indices': [129, 142]}]"
60,christianthom30,,2021-04-29 23:10:29,75,2,"Here's a quick look at Kunio and Riki's unique mechanic: Weapon Pickups! The River City Ransom characters have access to a handful of randomly spawning items including dodgeballs, baseball bats and pipes!

Coming Soon to Mighty Fight Federation! https://t.co/HnnnTjZNqM",[]
61,Noles247,"Tallahassee, FL",2021-04-29 23:10:27,40931,0,Pre-Series Notes: FSU set to host Troy for weekend series https://t.co/YupYRUDJKF,[]
62,leslie_amandaa,"Houston, TX",2021-04-29 23:10:26,362,0,Me watching the nfl draft🤝wishing I liked football guys more than baseball,[]
63,duluthnews,"Duluth, MN, US, 55802",2021-04-29 23:10:25,38767,0,"Kepler and Garlick both cleared COVID-19 protocols while Sano is rehabbing hamstring
 https://t.co/3bmAXZtoer",[]
64,blinkbl52190472,,2021-04-29 23:10:25,25,220,"Yoona talking about her legendary meme of throwing a baseball and she explained that she's serious about throwing a ball that during concert tours she would throw the signed ball up to the 2nd floor 💪🏻

Even Sica was amazed with Yoong's throwing skills and Yoong's just like 💁🏻‍♀️😏 https://t.co/1NRRe6AEms",[]
65,FlippinBatsPod,,2021-04-29 23:10:24,660,0,"Yes, we're a baseball podcast, but @Phillies 1B @rhyshoskins is both an @Eagles and a @Raiders fan! 

And on #NFLDraft Day he tells @Verly32 about both of the passionate fan bases! https://t.co/Q7A2koZIhl","[{'text': 'NFLDraft', 'indices': [109, 118]}]"
66,FamousPixs,,2021-04-29 23:10:24,1931,1,Daily News |  The Phillies did not avenge Bryce Harper. They are better off for it. | David Murphy https://t.co/sOx90t459D,[]
67,HERXNDALESWIFE,#𝐓𝐎𝐌: Ciaraaaaa.,2021-04-29 23:10:22,333,2713,"RT this for a chance to win a @dylanobrien signed baseball! ⚾️✍️ 

#dylanobrien 🔸 #LoveAndMonsters 🔹 #LGM https://t.co/FtHc3Da9Ji","[{'text': 'dylanobrien', 'indices': [77, 89]}, {'text': 'LoveAndMonsters', 'indices': [92, 108]}, {'text': 'LGM', 'indices': [111, 115]}]"
68,Heavenorvegas_,"Diamond State, USA",2021-04-29 23:10:21,486,0,@hesinnocent_69 I don’t watch baseball and i don’t care about the hawks,[]
69,annaabigail5,,2021-04-29 23:10:19,16,550,"""That's what baseball is, that's what sports is, it's to put a smile on people's faces.""

@FreddieFreeman5 😊 | #ForTheA https://t.co/4mJ2zZVjVu","[{'text': 'ForTheA', 'indices': [123, 131]}]"
70,KristenKuzell,,2021-04-29 23:10:18,16,2713,"RT this for a chance to win a @dylanobrien signed baseball! ⚾️✍️ 

#dylanobrien 🔸 #LoveAndMonsters 🔹 #LGM https://t.co/FtHc3Da9Ji","[{'text': 'dylanobrien', 'indices': [77, 89]}, {'text': 'LoveAndMonsters', 'indices': [92, 108]}, {'text': 'LGM', 'indices': [111, 115]}]"
71,mnbaseball2020,"Omaha, NE",2021-04-29 23:10:17,884,0,"VARSITY BASEBALL:
Papio South 4 - MN 1 https://t.co/Ieyr8ZRGam",[]
72,CubsZone,"Chicago, IL",2021-04-29 23:10:14,15462,1,Kris Bryant. Baseball Player. @obvious_shirts https://t.co/IFYMayLt1j,[]
73,godmanblasta,,2021-04-29 23:10:12,0,0,@QuadieDiesel Wonder if she going for baseball next🧐,[]
74,JWolperPGH,Pittsburgh,2021-04-29 23:10:12,210,0,"@tangotiger Through most of baseball history, the starting pitcher was expected to stay in until the outcome was decided, and W/L reflected that well. It's less useful now, but that doesn't mean that it wasn't good in the past.",[]
75,ffelicityg,"Dallas, TX",2021-04-29 23:10:12,427,3,im tryna go to a baseball game,[]
76,jblo51,,2021-04-29 23:10:11,15,0,@destiny_lugardo No crying in baseball,[]
77,tangible_uno,Northeast Ohio,2021-04-29 23:10:10,729,0,NOTICE: I want to interview professional Black baseball players from throughout the diaspora. This series is not and will not be limited to Black American players. Black baseball players of all ethnicities/nationalities who speak English are welcome.,[]
78,RealPaulCortese,"Danbury, CT",2021-04-29 23:10:09,428,302,"It’s #NFLDraft Day, so you know we had to post about Prime Time. In his return to baseball in ‘01, he had an electric day at the plate. https://t.co/KquGG5lXer","[{'text': 'NFLDraft', 'indices': [19, 28]}]"
79,derekfoster___,"Texas, USA",2021-04-29 23:10:09,362,3,⚾️ @SamChampionHS honored Baseball Coach Chuck Foster last night at the final home game of his coaching career. Coach Foster has over 400 career victories and led @Boernehs to the 2004 Class 4-A State Championship. Coach is retiring at the end of the school year. Thank you! 🙏 https://t.co/botLK7ShUi,[]
80,MelissaMeador14,"Amory, MS",2021-04-29 23:10:09,2159,0,"Baseball, T5: Hamilton 7, Jumpertown 1. Lions scored 5 in the first, including RBI hits by Drake Pittman and Evan Pounders.",[]
81,RAWE_RECRUITS,"Gainesville, FL",2021-04-29 23:10:08,2521,0,"Beautiful day to have a district championship baseball game.

Williston. Newberry. FHSAA Class 1A-7 Title. ⚾️

#RAWE 🌋

@ThePrepZone @mpallman @ridaught @cassrswartz @ByJordanKroeger @ByCoreyDavis @WMHSRedDevils @DCCoachJ5 @NewberryHSFB https://t.co/heCI5NcntB","[{'text': 'RAWE', 'indices': [111, 116]}]"
82,ilastilinski91,,2021-04-29 23:10:06,11,2713,"RT this for a chance to win a @dylanobrien signed baseball! ⚾️✍️ 

#dylanobrien 🔸 #LoveAndMonsters 🔹 #LGM https://t.co/FtHc3Da9Ji","[{'text': 'dylanobrien', 'indices': [77, 89]}, {'text': 'LoveAndMonsters', 'indices': [92, 108]}, {'text': 'LGM', 'indices': [111, 115]}]"
83,Scout2462,"Spokane, WA",2021-04-29 23:10:06,394,2,"Gonzaga baseball has postponed its next seven games due to coronavirus protocols within the program, the school announced Thursday 
https://t.co/SXTUOwYSYP",[]
84,AsalhConvention,"Florida, USA",2021-04-29 23:10:05,1144,3,"#OTD 1949, Franklin native George Crowe became the 1st African American from Indiana to sign with a major league baseball team, the Boston Braves. This was two years after Jackie Robinson broke Major League Baseball’s color line. https://t.co/Vv9Bpu1eUs https://t.co/3dqB1XgOkh","[{'text': 'OTD', 'indices': [15, 19]}]"
85,Maria47537506,,2021-04-29 23:10:04,0,2713,"RT this for a chance to win a @dylanobrien signed baseball! ⚾️✍️ 

#dylanobrien 🔸 #LoveAndMonsters 🔹 #LGM https://t.co/FtHc3Da9Ji","[{'text': 'dylanobrien', 'indices': [77, 89]}, {'text': 'LoveAndMonsters', 'indices': [92, 108]}, {'text': 'LGM', 'indices': [111, 115]}]"
86,TFTwins,Minnesota,2021-04-29 23:10:03,5226,0,"Nobody wanted this dude a few months ago. 
Baseball. https://t.co/0wcaBjP3mr",[]
87,DreamLanny,"Gulf Shores, AL",2021-04-29 23:10:02,2158,0,"@Nikarjay The Dream All-American Series (DAAS) is looking to find the best 2022-2025 Baseball, Basketball, Soccer, &amp; Softball players to compete and gain recruiting exposure. If interested, please go to the website to get info and to be nominated.  https://t.co/IPdiX5dIrx https://t.co/d3DJ5La2av",[]
88,Jfree36008,"Boston, MA",2021-04-29 23:10:02,472,0,The two goalies in BOS-BUF have 9 Ks between them. Feels like I’m watching a baseball game 😮 https://t.co/yPr1eHn30R,[]
89,ASALH,Washington DC,2021-04-29 23:10:00,10400,3,"#OTD 1949, Franklin native George Crowe became the 1st African American from Indiana to sign with a major league baseball team, the Boston Braves. This was two years after Jackie Robinson broke Major League Baseball’s color line. https://t.co/Vv9Bpu1eUs https://t.co/3dqB1XgOkh","[{'text': 'OTD', 'indices': [15, 19]}]"
90,bradmeyer71,,2021-04-29 23:10:00,51,0,@RonBlomberg1 Totally agree!! I hope a little common sense returns to baseball before they ruin it forever,[]
91,jjoseph76,,2021-04-29 23:10:00,26,0,"@matthaiduk @Super70sSports Not sure what your point is? Because they happened to get drafted to bad teams, somehow makes Andre Dawson less of an icon? Expos sucked too. Baseball requires more than one guy to be good over 162 games.",[]
92,BeaverdaleJason,Iowa,2021-04-29 23:10:00,332,30,I demanded answers today from the FBI as to why the Congressional baseball practice shooting that injured several people including a Capitol Police officer and my friend ⁦@SteveScalise⁩ was classified as suicide by cop instead of domestic terrorism.  https://t.co/lmdUB6B8Uu,[]
93,ClintonDNSports,"Clinton, Oklahoma",2021-04-29 23:10:00,1336,0,"Pepsi Baseball Update 
Final 
Clinton 12
Pauls Valley 2
Make that 27 district/bi-district titles 🏆 in a row. Clinton (17-13 overall) sweeps PV to keep the streak going and advance to regionals. 
#OKPreps","[{'text': 'OKPreps', 'indices': [195, 203]}]"
94,DennisCGarcia,"Hinsdale, Illinois",2021-04-29 23:09:58,2646,0,"Yes #AaronBoone should be replaced. 

We need a legit baseball manager who can lead and make players better - not a corporate adminstrator. https://t.co/Gnw5IBo1ml","[{'text': 'AaronBoone', 'indices': [4, 15]}]"
95,Carey3709,United States,2021-04-29 23:09:58,140,2713,"RT this for a chance to win a @dylanobrien signed baseball! ⚾️✍️ 

#dylanobrien 🔸 #LoveAndMonsters 🔹 #LGM https://t.co/FtHc3Da9Ji","[{'text': 'dylanobrien', 'indices': [77, 89]}, {'text': 'LoveAndMonsters', 'indices': [92, 108]}, {'text': 'LGM', 'indices': [111, 115]}]"
96,L8diesLoveCoolj,BK & PA,2021-04-29 23:09:57,698,997,This might be the baseball moment of the season right here. https://t.co/dFBFwb8UKQ,[]
97,TheXboxPrincess,"Normal, Illinois",2021-04-29 23:09:54,797,7,"Cubs manager David Ross, on Rizzo striking out Freddie Freeman:

""The reaction between those two human beings was just good for baseball last night. As bad as it sucks to lose, rewatching that ... it was nice to have that light moment at the back end of a crappy game.""",[]
98,aynbluefish,,2021-04-29 23:09:54,140,29,"Good reminder that Joe Biden went on ESPN on opening day of the baseball season and “strongly urged” MLB to move the All Star Game, while repeating debunked lies about the state’s election law. 

They complied THAT DAY.

He and Stacey Abrams own the $100M loss. And they know it. https://t.co/fFkBX0XDTe",[]
99,captainkall5,,2021-04-29 23:09:53,48,0,@nerdist Ken Burns’ Baseball,[]
